{
  "$schema": "https://aegaeon.dev/spec/kms-hsm-deployment-classification.schema.json",
  "algorithm": {
    "jose_alg": "RS256",
    "provider_algorithm": "RSASSA_PKCS1_V1_5_SHA_256"
  },
  "claim_boundary": {
    "broad_rsa_not_promoted": true,
    "external_signer_recorded_as_tcb": true,
    "rs256_required_slice_unchanged": true
  },
  "classification": "claim-preserving",
  "compat_reason": null,
  "deployment_id": "aws-kms-localstack-rs256-parity",
  "generated_at": "2026-06-18T00:00:00Z",
  "jwks_rotation": {
    "kid_reuse_prevented": true,
    "overlap_matches_local_path": true,
    "rollback_matches_local_path": true
  },
  "parity_evidence": {
    "generated_at": "2026-05-19T23:09:40Z",
    "status": "pass",
    "uri": "evidence/localstack-oidc-kms-summary.json"
  },
  "public_jwk_derivation": {
    "key_match_checked": true,
    "method": "provider-api"
  },
  "review": {
    "decision": "approved",
    "notes": "Approved only for the internal LocalStack-backed AWS KMS RS256 parity shape; production or hosted claim activation still requires fresh deployment evidence.",
    "reviewer": "internal-assurance-baseline"
  },
  "schema_version": 1,
  "signer_backend": "aws-kms",
  "signing_input_ownership": {
    "aegaeon_constructs_jws_signing_input": true,
    "provider_returns_finished_jwt": false
  },
  "source_revision": "4f6764449322d634ffee35a8c694dadfd4b90feb"
}
